{
  "$schema": "https://json-schema.org/draft/2020-12/schema",
  "$id": "ads-engine/creative-pack@1",
  "title": "Ads Engine – kreatív-csomag (creatives.json)",
  "description": "Kész hirdetések, amelyeket a projekt ad a motornak. A szövegek hossza itt is ellenőrzött (a Google korlátai szerint); a tartalmi szabályokat (tények, tiltott szavak, írásjelek) a motor és a validátor kódban ellenőrzi.",
  "type": "object",
  "required": ["schema_version", "version", "adsets"],
  "additionalProperties": false,
  "properties": {
    "schema_version": {"const": 1},
    "version": {"type": "string", "minLength": 1, "maxLength": 40, "description": "A csomag verziója (pl. 2026-10-05.1). Változáskor a motor új adatot lát."},
    "adsets": {
      "type": "array", "minItems": 1, "maxItems": 20,
      "description": "Hirdetéscsoportok (egy téma/keresési szándék = egy csoport).",
      "items": {
        "type": "object",
        "required": ["id", "channel", "theme", "landing", "headlines", "descriptions", "keywords"],
        "additionalProperties": false,
        "properties": {
          "id": {"type": "string", "pattern": "^[a-z0-9_-]{1,30}$"},
          "channel": {"enum": ["search"], "description": "Egyelőre: search (reszponzív keresési hirdetés)."},
          "theme": {"type": "string", "maxLength": 60, "description": "A hirdetéscsoport neve/témája."},
          "landing": {"type": "string", "pattern": "^[a-z0-9_-]{1,30}$", "description": "A brief landing_pages egyik azonosítója."},
          "headlines": {"type": "array", "minItems": 3, "maxItems": 15, "items": {"type": "string", "minLength": 1, "maxLength": 30}, "description": "Címek, legfeljebb 30 karakter, felkiáltójel nélkül."},
          "descriptions": {"type": "array", "minItems": 2, "maxItems": 4, "items": {"type": "string", "minLength": 1, "maxLength": 90}, "description": "Leírások, legfeljebb 90 karakter, legfeljebb egy felkiáltójellel."},
          "path1": {"type": "string", "maxLength": 15},
          "path2": {"type": "string", "maxLength": 15},
          "keywords": {
            "type": "array", "minItems": 1, "maxItems": 40,
            "items": {
              "type": "object", "required": ["text", "match"], "additionalProperties": false,
              "properties": {
                "text": {"type": "string", "minLength": 2, "maxLength": 80},
                "match": {"enum": ["PHRASE", "EXACT"], "description": "Kifejezés vagy pontos egyezés (széles egyezés nincs)."}
              }
            }
          },
          "negatives": {"type": "array", "maxItems": 100, "items": {"type": "string", "minLength": 2, "maxLength": 80}, "description": "Csak erre a csoportra érvényes negatív kulcsszavak."}
        }
      }
    },
    "sitelinks": {
      "type": "array", "maxItems": 8,
      "items": {
        "type": "object", "required": ["text", "landing"], "additionalProperties": false,
        "properties": {
          "text": {"type": "string", "minLength": 1, "maxLength": 25},
          "description1": {"type": "string", "maxLength": 35},
          "description2": {"type": "string", "maxLength": 35},
          "landing": {"type": "string", "pattern": "^[a-z0-9_-]{1,30}$"}
        }
      }
    },
    "callouts": {"type": "array", "maxItems": 10, "items": {"type": "string", "minLength": 1, "maxLength": 25}, "description": "Kiemelések (pl. Ingyenes, Regisztráció nélkül)."},
    "images": {
      "type": "array", "maxItems": 20,
      "items": {
        "type": "object", "required": ["id", "file", "alt"], "additionalProperties": false,
        "properties": {
          "id": {"type": "string", "pattern": "^[a-z0-9_-]{1,40}$"},
          "file": {"type": "string", "maxLength": 300, "description": "A kép fájlja (relatív a creatives.json-hoz vagy abszolút https), JPEG vagy PNG, legfeljebb 5 MB."},
          "ratio": {"enum": ["1.91:1", "1:1", "4:5"], "description": "Az arány; ha nincs, a motor a méretből állapítja meg, és ha kell, a Google méreteire vágja."},
          "alt": {"type": "string", "minLength": 3, "maxLength": 125, "description": "Alternatív szöveg (akadálymentesség, a kép tartalma)."}
        }
      }
    },
    "logos": {
      "type": "array", "maxItems": 4,
      "items": {
        "type": "object", "required": ["id", "file"], "additionalProperties": false,
        "properties": {"id": {"type": "string", "pattern": "^[a-z0-9_-]{1,40}$"}, "file": {"type": "string", "maxLength": 300}}
      }
    },
    "videos": {
      "type": "array", "maxItems": 10,
      "items": {
        "type": "object", "required": ["youtube_id", "orientation"], "additionalProperties": false,
        "properties": {
          "youtube_id": {"type": "string", "pattern": "^[A-Za-z0-9_-]{11}$"},
          "orientation": {"enum": ["vertical", "horizontal", "square"]},
          "title": {"type": "string", "maxLength": 100}
        }
      }
    }
  }
}
